[
  {
    "id": "atk_longsword_01",
    "name": "Longsword Slash",
    "description": "A precise melee slash with a steel blade.",
    "type": "melee",
    "damage_type": "slashing",
    "value": "1d8+3",
    "hit_modifiers": 2,
    "status_effects": null
  },
  {
    "id": "atk_fire_arrow_01",
    "name": "Fire Arrow",
    "description": "A ranged attack that ignites the target.",
    "type": "ranged",
    "damage_type": "piercing",
    "value": "1d6+2",
    "hit_modifiers": 1,
    "status_effects": ["se_dot_fire_01"]
  },
  {
    "id": "atk_shield_bash_01",
    "name": "Shield Bash",
    "description": "A forceful bash that can stun.",
    "type": "unarmed",
    "damage_type": "bludgeoning",
    "value": "1d4+1",
    "hit_modifiers": 0,
    "status_effects": ["se_ctrl_01"]
  }
]
